language,id,text,file,node,lineNumber,lock,comment
en,line:project-package,"When you package the chart project into a playable t3pkg file in the editor, this editor-specific content is automatically cleaned up, and the chart file extension is changed to [b].json[/b].",D:\AllProject\UnityProjects\TAKANA_Cubic\Assets\Resources\Tutorial\Postprocess.yarn,Postprocess,14,364fae4a,
en,line:project-autosave,"As you continue working, the chart project folder will gain two subfolders: AutoSave and Logs, which store autosaved files and error logs respectively.",D:\AllProject\UnityProjects\TAKANA_Cubic\Assets\Resources\Tutorial\Postprocess.yarn,Postprocess,16,2e779a2c,
en,line:project-logs,"If something goes wrong during editing, please submit the log file from Logs for the current date to the author via an issue or other means.",D:\AllProject\UnityProjects\TAKANA_Cubic\Assets\Resources\Tutorial\Postprocess.yarn,Postprocess,18,cad6613c,
en,line:note-time,"Now for some things worth noting. First, all time values in the editor are integers in milliseconds.",D:\AllProject\UnityProjects\TAKANA_Cubic\Assets\Resources\Tutorial\Postprocess.yarn,Postprocess,20,f53988d6,
en,line:note-coord,"The center of the preview has an x-coordinate of 0, the preview boundaries are at ±5, and the in-game play boundaries at ±4.5.",D:\AllProject\UnityProjects\TAKANA_Cubic\Assets\Resources\Tutorial\Postprocess.yarn,Postprocess,22,189019c7,
en,line:note-format-why,"When editing a chart, it's easy to accidentally introduce hard-to-find errors, like placing a Note on a track with zero width.",D:\AllProject\UnityProjects\TAKANA_Cubic\Assets\Resources\Tutorial\Postprocess.yarn,Postprocess,24,ac79d516,
en,line:note-format-how,"When that happens, click the small arrow at the bottom of the interface and select the Format Chart function from the toolbar — it will automatically fix potential errors in your chart.",D:\AllProject\UnityProjects\TAKANA_Cubic\Assets\Resources\Tutorial\Postprocess.yarn,Postprocess,26,8af96ed4,
en,line:note-format-reminder,"Before packaging into a playable file, be sure to run the formatter at least once.",D:\AllProject\UnityProjects\TAKANA_Cubic\Assets\Resources\Tutorial\Postprocess.yarn,Postprocess,28,e506bd70,
